{
  "candidateLabel": "candidate-b",
  "cycle": 1,
  "roleInstanceId": "cycle-1-tester",
  "workerId": "template-tester-worker-id",
  "runtimeInvocationId": "00000000000000000000000000000000",
  "runtimeProcessId": 1,
  "runtimeThreadId": "runtime-thread-id-required-at-run",
  "snapshotCommit": "0000000000000000000000000000000000000000",
  "startedAt": "2026-07-20T00:00:00Z",
  "completedAt": "2026-07-20T00:00:00Z",
  "command": "npm run check",
  "exitCode": 0,
  "componentResults": [
    {
      "command": "npm run format:check",
      "exitCode": 0
    },
    {
      "command": "npm run lint",
      "exitCode": 0
    },
    {
      "command": "npm run typecheck",
      "exitCode": 0
    },
    {
      "command": "npm run test:public:if-implemented",
      "exitCode": 0
    },
    {
      "command": "npm run build",
      "exitCode": 0
    }
  ],
  "rawOutputSha256": "0000000000000000000000000000000000000000000000000000000000000000",
  "workingTreeClean": true
}
